patient_id,visit_date,heart_rate,systolic_bp,diastolic_bp,temperature,spo2,symptom_text,missed_visits,response_delay_hours,wellbeing_score,anomaly_score,is_flagged,severity_grade,severity_category,severity_rationale,dropout_risk,alert_level,alert_message
12,2026-03-28,76,118,76,98.4,98,"Mild tiredness after a long day, otherwise feeling okay.",0,2,8,0.0,False,1,Fatigue,Reported fatigue appears mild based on text.,0.0,MONITOR,Patient 12 — currently stable. Continue monitoring.
23,2026-03-28,96,108,70,99.2,96,Feeling more tired than usual with some nausea since yesterday.,1,14,6,0.0,False,2,Nausea,Symptoms suggest moderate gastrointestinal adverse event.,0.5,WARNING,Patient 23 — moderate risk detected. Coordinator review recommended.
31,2026-03-28,118,90,58,101.4,92,"Fever with chills, vomiting, weakness, and shortness of breath.",2,32,3,1.0,True,2,Nausea,Symptoms suggest moderate gastrointestinal adverse event.,0.9999999999999999,CRITICAL,Patient 31 — multi-signal escalation. Immediate follow-up required.
47,2026-03-28,109,94,60,100.3,94,Mild fatigue and tingling in fingers for the past two days.,2,28,4,0.9,True,2,Peripheral Neuropathy,Reported tingling/numbness indicates possible moderate neuropathy.,0.9999999999999999,CRITICAL,Patient 47 — multi-signal escalation. Immediate follow-up required.
55,2026-03-28,88,122,80,98.9,97,Occasional headache but overall manageable and able to continue daily tasks.,0,6,7,0.0,False,1,General Adverse Event,Low-confidence default classification based on limited symptom detail.,0.0,MONITOR,Patient 55 — currently stable. Continue monitoring.
